{
  "schemaVersion": 1,
  "id": "visual-locomotion",
  "seed": 839102,
  "agents": 40,
  "previewDays": 0,
  "warmupFrames": 30,
  "measuredFrames": 540,
  "ticksPerFrame": 0,
  "minimumFps": 0,
  "panel": "locomotion",
  "outputDirectory": "runs/evaluation/visual-locomotion",
  "captureFrames": [
    45,
    90,
    92,
    94,
    96,
    98,
    100,
    102,
    104,
    106,
    108,
    110,
    112,
    114,
    116,
    118,
    120,
    122,
    124,
    126,
    128,
    130,
    132,
    134,
    136,
    138,
    240,
    360,
    540
  ]
}
