{
  "schemaVersion": 1,
  "id": "visual-forearm-frames",
  "seed": 839102,
  "agents": 40,
  "previewDays": 0,
  "warmupFrames": 60,
  "measuredFrames": 120,
  "ticksPerFrame": 0,
  "minimumFps": 0,
  "panel": "forearm-frames",
  "outputDirectory": "runs/evaluation/visual-forearm-frames",
  "captureFrames": [90]
}
