{
  "schemaVersion": 1,
  "seed": 839102,
  "agents": 40,
  "previewDays": 0,
  "warmupFrames": 60,
  "measuredFrames": 120,
  "ticksPerFrame": 0,
  "minimumFps": 0,
  "id": "visual-architecture",
  "panel": "architecture",
  "outputDirectory": "runs/evaluation/visual-architecture",
  "captureFrames": [
    90
  ]
}
