{
  "schemaVersion": 1,
  "id": "visual-work-effort",
  "seed": 839102,
  "agents": 40,
  "previewDays": 0,
  "warmupFrames": 60,
  "measuredFrames": 360,
  "ticksPerFrame": 0,
  "minimumFps": 0,
  "panel": "work-effort",
  "outputDirectory": "runs/evaluation/visual-work-effort",
  "captureFrames": [
    90,
    180,
    260,
    360
  ]
}
